Headline,category1,category2,category3,category4
Why bears are feeling more at home near people,national news,,,
The earliest iteration of Mickey Mouse entered the public domain and things got weird fast,,culture,tabloid-style news,
From Avatar to Dune: The most anticipated new shows and movies of 2024 and where to watch them,,culture,,
Bollywed: Daddy Marketing,culture,,,
Push: The Higher You Climb,culture,,,
Malcom is Missing: People don't just vanish,culture,,,
Marketplace: Germy Gyms,national news,,,
Sci-fi storytelling gives us the tools to imagine better futures says researcher,,culture,,
This Ontario live music legend went off-grid for 15 years. Now he's back,local news,culture,,
'I think it's magic' UK artist finds her passion — and love — making miniatures in Canada,local news,culture,,
'No fun': Toronto bans tobogganing at 45 hills across city says councillor unhappy with move,,local news,,
Ruiter halts Schizas's 3-peat bid in women's program at Canadian figure skating championships,sports,,,
Mark Critch is paying tribute to his dad by impersonating him,culture,,,
Comedian D.J. Demers turned his teenage job into an absurd workplace comedy,culture,,,
Alberta's electrical grid recovers after extreme cold prompts threat of rolling power outages,local news,,,
Small-brained hominid species challenges human exceptionalism says paleoanthropologist,,national news,,
Why a first-time parent decided to adopt a 20-year-old,national news,tabloid-style news,,
Edmonton's record-breaking cold expected to continue for 3rd day in a row,local news,,,
Drive-thru or order inside: What's the quickest way to get your fast food?,national news,,,
Why some people are turning to wellness and self-care to replace religion,national news,culture,,
As clock ticks down to CEBA deadline business owners plead for understanding from government,,national news,,
Canada's Fernandez wins opening match at Australian Open in straight sets,sports,,,
3 must-read books for lovers of historical fiction,culture,,,
Oilers beat Canadiens in OT for franchise-record 10th straight win,sports,,,
What kids should know about the Quaker Canada recall,national news,,,
The Russians are spending big on infrastructure to absorb occupied Ukraine,national news,,,
Winter safety tips for dogs: Expert advice to keep them healthy and warm,national news,,,
Trump must pay New York Times 3 reporters nearly $400000 US in legal fees,,,national news,politics
5 pieces of classical music to help you appreciate snow,culture,,,
More men are reporting sexual misconduct in the military. This survivor says it's a move in right direction,national news,,,
Mahomes Rice lead Kansas City to wild-card win over Miami in 4th-coldest game in NFL history,,sports,,
Allegiance: Supply Side,culture,,,
Liberals rebranding carbon tax rebate to ensure Canadians know where the money comes from,national news,politics,,
If Alicia Keys's voice cracks at the Super Bowl but it's edited out did it even happen?,,,culture,tabloid-style news
Why Wab Kinew thinks it's Manitoba's turn now,local news,politics,,
Soerensen named to Canada's figure skating world championships team amid allegations,sports,,,
How social media is influencing the romance novel genre — and wider trends in fiction,culture,,,
U.S. briefs Canada other allies about security concern involving Russia,,national news,politics,
Allies aid groups warn against ground invasion of Rafah as Israeli offensive looms,,national news,politics,
Police say 1 dead at least 8 children among 22 injured after shooting near Kansas City's Super Bowl parade,,national news,,
Rent hits another record high in January as average asking price reaches $2196,,national news,,
Newfoundlanders slighted by VRBO ad that uses I's the B'y,local news,tabloid-style news,,
Don't write don't show up! Tips for healing a heartbreak,,culture,,
The toll of cannabis-induced psychosis,national news,,,
Toronto cop facing charges for allegedly watching porn while on duty slapping an officer's behind,,local news,tabloid-style news,
One More Time: Bed Bugs,culture,,,
22 Minutes: Snow Joke,culture,,,
Son of a Critch: My Funny Valentine,culture, tabloid-style news,,
Run the Burbs: Phright Night,culture, tabloid-style news,,
'Disgraced' police officer's role dooms charges in $30M drug bust,national news,,,
Is Jon Stewart still the right person to host The Daily Show?,culture, national news, gossip,
Maple Leafs' Rielly to appeal 5-game suspension to NHL commissioner Bettman,sports,,,
Feds will stop investing in 'large' road projects environment minister says,,politics, national news,
What's 'good sex' anyway?,,sex, culture,
Blue Jays' Manoah in spotlight with pitchers catchers set to report to spring training,,sports,,
He got a box of penises in the mail but not the ones he's looking for,,tabloid-style news, gossip,
Someone stole this superfan's 'priceless' photo of hockey legend Jean Béliveau and he wants it back,local news, sports,,
Blue Jackets' Laine and his agency criticize suicide remark made about him on podcast,sports, national news, gossip,
12 Ontario men 1 American arrested in Niagara for trafficking young people: police,,national news, local news,
Canadian songwriters and producers credited on new Beyoncé songs,culture, national news,,
Greater Sudbury police officer charged with assaulting a 12-year-old suspended with pay,,local news,,
Safe in Winnipeg these Ukrainians still hold out hope for the war at home,,national news, local news,
Lululemon marketing complaint could be a test of Canada's greenwashing laws expert says,,national news, fashion,
Why some Canadian car dealerships don't want your cash,national news,,,
Leylah Fernandez takes down 5th seed to reach Qatar Open quarterfinals,sports,,,
Why some P.E.I. bus drivers are getting fed up with their new electric school buses,local news,,,
14 Canadian books about love to read this Valentine's Day,culture, national news,,
Arrest made in theft of Jackie Robinson statue later found dismantled burned,,national news,,
How my epic fail of a preteen makeover made me a star. Sort of,tabloid-style news, culture, gossip ,
Inside a suburban Quebec home teeming with lush plants of every size,local news, culture,,
She was shot 13 times in an attack that killed both her parents. Now she's speaking out,national news, tabloid-style news,,
2 years to Italy: An early look at Canada's potential Olympic women's hockey roster,sports, national news,,
Neil Young announces new tour and album with Crazy Horse,culture, national news,,
Marketplace: The Big Bank Upsell,national news,,,
The Kate photo scandal has tested the public's trust. How do the Royals get it back?,gossip, national news,,
It's 2004 somewhere (or time isn't real according to pop culture),,culture, national news,
Wayne Gretzky to deliver eulogy at Brian Mulroney's state funeral in Montreal,national news, politics,,
Hairless raccoon found in Cape Breton puzzles wildlife rescuers,local news,,,
The Pornhub Empire: Understood,culture, sex,,
Solar eclipse chasers travel the world for a few minutes in the shadow of the moon,culture, national news,,
Hidden cameras capture bank employees misleading customers pushing products that help sales targets,,national news,,
Alberta government releases no-go zone map for renewable power projects,politics, local news ,,
The Kate photo scandal has tested the public's trust. How do the Royals get it back?,gossip, national news,,
At Issue | Premiers push Trudeau to pause carbon tax hike,politics, national news,,
Prehistoric kids loved to have fun too!,culture, national news,,
Rocco the dog to be returned to late owner's family after Ontario judge rejects girlfriend's stay request,local news, tabloid-style news,,
Drag queen star Kyne Santos is teaching math to show people how to see the world differently,culture, gender identity, national news,
Long Time Running: The Tragically Hip's iconic tour & emotional final concert,culture, national news,,
20th Century Women (starring Greta Gerwig Elle Fanning Annette Bening),,,culture,
Wild Cards: Romancing the Egg,culture, tabloid-style news ,,
One More Time: Curs-ed,culture, tabloid-style news,,
Long hair was incredibly important to Chi Nguyễn. They were devastated when it started to fall out,gender identity, culture, national news,
Former Quebec judge pleads guilty to manslaughter in wife's death,national news, local news,,
Banking insiders reveal how sales pressure can harm Canadians,national news,,,
Chef Dwight Smith's chicken pot pie recipe is the epitome of comfort food,culture, national news,,
This entrepreneur says her luxury activewear brand makes customers 'actually want to get pregnant',fashion, gossip, national news,
A look inside Peterborough's transitional housing program,local news,,,
The top 10 Canadian inventions of all time: Nature of Invention,culture, national news,,
LATAM Boeing 787 abruptly drops mid-flight injuring dozens,,national news,,
Make these Middle Eastern stuffed onions for a warming weeknight meal,culture, national news,,
Who is Katie Britt the 'MAGA enough' senator? | About That,,politics, national news,
9 epic Johnstons adventures to discover,culture, national news,,
With $500 and a sewing machine this entrepreneur is running a multimillion dollar scrunchie empire,,fashion, national news,
6 stunning high-altitude lakes to visit in British Columbia,culture, local news,,
How the CIA has used the Meow Mix jingle,gossip, national news ,,
Canadian siblings' light approach reaps benefits on the LPGA Tour,sports, national news,,
A simple weeknight curry starring jammy 7-minute eggs,culture, national news,,
Meet the newest sports power couple Japan's Shohei Ohtani and Mamiko Tanaka,,sports, gossip, national news
Want to be on reality TV? Here's how to impress a casting producer,culture, gossip, national news,
Woman killed 2 arrested near University of British Columbia campus lands,,,local news,
B.C. couple faces fines legal action over custom-built tiny home on rural property,,local news,,
Buying a mobile home was the best financial decision his family made — just don't call it a trailer,national news, culture,,
As 'where's Kate' conspiracy theories run wild here's how the story became such a royal mess,,gossip, national news,
Why is this veterinary assistant dressed like a fox at work?,tabloid-style news, gossip, local news,
My mother worked for Britain's spy agency in the 1960s. Can I get her to reveal her secrets?,culture, national news, gossip,
Raptors star RJ Barrett family mourning death of younger brother,,sports, national news,
My grandma sang her way to Canada at a time when Chinese people were barred entry,culture, national news,,
How Grey's Anatomy helped shape network TV and strong female friendships,culture, national news ,,
Alcaraz survives bee swarm to beat Zverev advance to Indian Wells semifinals,,sports, national news,
How this brand has outsold Coke in Scotland for over a century,national news, culture,,
Sports bettors forced to wait weeks for winnings from OLG,local news, sports,,
Canada's earlier Olympic mixed doubles curling trials puts athletes in hurry-up mode,sports, national news,,
Jury finds Michigan school shooter's father guilty of involuntary manslaughter,national news,,,
Mike Tyson unlikely to turn back clock in novelty boxing match against Jake Paul,sports, gossip, national news,
Probe clears military police in case of pilot charged with sexual assault who took his own life,national news, sex,,
5 ways Neanderthals were more like modern humans than we thought,culture, national news,,
Death of non-binary teen Nex Benedict ruled a suicide medical examiner says,,national news, gender identity,
A not-at-all exhaustive list of how (and how much) animals sleep,culture, national news,,
Sleep With Me,tabloid-style news, sex, culture,
1 year after the Pearson heist no arrests and no sign yet of all that gold and cash,,national news, tabloid-style news,
Nine minutes that changed the world,national news,,,
Coyotes sale expected within week Arizona to get NHL expansion team: report,,sports, national news,
Are tech giants ignoring their own policies in order to train their AI systems?,national news, culture,,
Netflix documentary revives interest in Canadian murder-for-hire case,culture, national news, tabloid-style news,
The shoe that revolutionized running: Nike's Big Bet,culture, national news, fashion,
Here's why people in Saskatchewan pronounce Calgary differently,local news, culture,,
Make roasted cauliflower with dates and herby farro for a hearty salad — or an exquisite main,culture, national news,,
Simple tax tips to maximize your refund in 2024,national news, culture,,
TikTok food critic Keith Lee gives big boost to Toronto restaurants,culture, local news,,
Conservatives showing biggest lead yet in new poll,politics, national news,,
This Cinnamon-Streusel Bread Pudding will steal the scene at your next brunch,culture, national news,,
#TheMoment 16 bear cubs were rescued by wildlife conservation team,culture, national news,,
Leaving Earth and seeing the planet from space changed him forever,culture, national news,,
Scholar believes she's found site of Hanging Gardens of Babylon — and it's not in Babylon,culture, national news,,
#TheMoment Pacific castaways were rescued after spelling 'HELP' with leaves,culture, national news,,
Pickup trucks flip after collision in East St. Paul,local news,,,
The Beaches vs AI,culture, national news,,
How to submit a compensation claim if you have an iPhone 6 or 7 in Canada,national news, culture,,
Fossil technicians release bones from rock and reconstruct iconic dinosaurs at this Ontario workshop,culture, local news,,
Israel mulls response to Iran attack; U.S. says it won't take part in any counter-offensive,politics, national news,,
'We were born knowing this is ours': B.C. signs deal recognizing Haida Nation title over Haida Gwaii,national news, local news, politics,
Experts predict tax hikes in budget as Trudeau government stretches to pay for its promises,politics, national news ,,
Golfer Scottie Scheffler wins Masters for 2nd green jacket in 3 years,sports, national news,,
Should I get a 30-year mortgage? | About That,national news, culture,,
This sunglasses business puts a new perspective in size-inclusivity,fashion, national news, culture,
Climate warrior Jane Goodall isn't sold on carbon taxes and electric vehicles,national news, culture, politics,
Should old-growth logging be banned? Debate over B.C. forests heats up,national news, local news, politics,
TikTok food critic Keith Lee gives big boost to Toronto restaurants,culture, local news ,,
Conservatives showing biggest lead yet in new poll,politics, national news,,
This Cinnamon-Streusel Bread Pudding will steal the scene at your next brunch,culture, national news,,
#TheMoment 16 bear cubs were rescued by wildlife conservation team,culture, national news,,
Leaving Earth and seeing the planet from space changed him forever,culture, national news,,
Scholar believes she's found site of Hanging Gardens of Babylon — and it's not in Babylon,culture, national news,,
#TheMoment Pacific castaways were rescued after spelling 'HELP' with leaves,culture, national news,,
Pickup trucks flip after collision in East St. Paul,local news,,,
The Beaches vs AI,culture, national news ,,
How to submit a compensation claim if you have an iPhone 6 or 7 in Canada,national news, culture,,
Fossil technicians release bones from rock and reconstruct iconic dinosaurs at this Ontario workshop,culture, local news,,
Israel mulls response to Iran attack; U.S. says it won't take part in any counter-offensive,politics, national news ,,
'We were born knowing this is ours': B.C. signs deal recognizing Haida Nation title over Haida Gwaii,national news, local news, politics,
Experts predict tax hikes in budget as Trudeau government stretches to pay for its promises,politics, national news,,
Golfer Scottie Scheffler wins Masters for 2nd green jacket in 3 years,sports, national news,,
Should I get a 30-year mortgage? | About That,national news, culture,,
This sunglasses business puts a new perspective in size-inclusivity,fashion, national news, culture,
Climate warrior Jane Goodall isn't sold on carbon taxes and electric vehicles,national news, culture, politics,
The scale and impact of clear-cut logging is evident from above | War for the Woods,national news, politics, culture,
Canadian Kimberly Polman explains why she joined ISIS: The Return: Life After ISIS,national news, culture,,
Great apes tease each other just like people do,,culture, national news,
7 songs you need to hear this week,culture, national news,,
'Nasty turn' in Guess Who fight sees Burton Cummings cancel agreements that let band perform his songs,culture, national news, gossip,
Canada's Gushue Switzerland's Tirinzoni claim titles at Players' Championship,,sports, national news,
When I went back to work motherhood became a discouraging puzzle of sick days and child care,,national news, culture,
Dramatic overskirts dropped waists and big-time bows: The top trends from Bridal Fashion Week Spring 2025,,fashion, national news, culture
Jacob Collier may be a musical genius but he's tired of working alone,,culture, national news,
Meet Canada's Moe Norman: Golf's misunderstood genius,sports, national news, culture,
Meet Manny Dingo the magnetic drag king redefining Black masculinity on stage,,culture, gender identity, national news
Israel mulls response to Iran attack; U.S. says it won't take part in any counter-offensive,politics, national news,,
Canada to face archrival U.S. in women's world hockey championship final,sports, national news,,
Judge questions debtor's sale of house to son for $1,national news, tabloid-style news,,
How an obscure '80s album helped this father and son connect,culture, national news,,
She was the sole girl on the boys' hockey team. Decades later she's cheering on the PWHL,,sports, national news, culture 
Plastic pollution is so bad for animals it now has a disease name — 'plasticosis',national news, culture,,
How do you find a beloved missing pet bird? It helps if it can talk,local news, culture, tabloid-style news,
Alberta premier says she's prepared to take Ottawa to court over housing deals,politics, national news, local news,
3 people rescued after a week stranded on remote Pacific island,national news, culture,,
Why what's good for your heart could also help delay dementia,national news, culture,,
Arizona Coyotes players informed team expected to move to Salt Lake City: reports,sports, national news,,
My body is extremely unusual. I've never seen another like it,national news, culture, tabloid-style news,
Scottie Scheffler leads Masters by 1 shot on wild day of movement,sports, national news,,
When we renewed our vows we also celebrated 20 years of our right to marry,,national news, culture, gender identity
Summer McIntosh caps off Canadian Open with 4th victory at event,sports, national news,,
You paid $850 for the Trans Mountain pipeline. Here's why,politics,,,
Officials seize around $500K worth of baby eels from Toronto Pearson Airport,local news,,,
Oilers crank up the offence beat Canucks 5-1 to force Game 7,sports,,,
Why the 'Can you hear me now?' guy sprinted to another brand,tabloid-style news,,,
Running horizontally could help future lunar settlers stay in shape on the Moon,national news,,,
Even a talking 'Meatbar' is a great idea if you 'Think Like an Artist',tabloid-style news,,,
N.B. pogo master bounces for the stars on Britain's Got Talent,tabloid-style news,,,
She spent 2 months underground with her baby as Russia attacked Mariupol,national news,,,
#TheMoment a snow leopard gave birth to two cubs at the Toronto Zoo,local news,,,
Ikky | 5 Songs that Changed My Life,culture,,,
Video appears to show Sean 'Diddy' Combs assault singer Cassie in 2016,gossip,,,
Hidden natural gems to explore in Ontario,local news,,,
RCMP link American serial killer to 4 Calgary murders,national news,,,
World's top golfer Scottie Scheffler goes from jail cell to the 1st tee,sports,,,
Why Victoria B.C. was once terrified of a Satanic cult,tabloid-style news,,,
Customers fed up with grocery store anti-theft measures,national news,,,
Eaton Centre's 9th floor restaurant making its return after 25 years,local news,,,
#TheMoment a raccoon interrupted an MLS game,sports,,,
Mae Martin has their brain scan analyzed to see what it says about gender,gender identity,,,
A one-pot chickpea curry that's creamy comforting and comes together in a flash,culture,,,
Hair is the 'canary in the coal mine' for living in a warmer dirtier world,national news,,,
N.S. doctor predicted decades ago his daughter's murder would be solved. Now it has been,national news,,,
Helicopter carrying Iran's president makes rough landing Iranian media say,national news,,,
I fled to the city to feel safer as a gay man. I never imagined I'd move back to a small town,culture,,,
A rare royal double act from King Charles and Prince William as rift with Prince Harry drags on,gossip,,,
Why 4 falcon eggs have a new home and a new mother on a Montreal bridge,local news,,,
Intimacy educator Shan Boodram answers some big questions about sex,sex,,,
An epic swim in Ottawa's Rideau Canal pushes competitors to their limits,sports,,,
How you spend your time reveals a lot about your personality,national news,,,
Canada is facing an 'unprecedented' wildfire season. Here's how to stay safe,national news,,,
'Looksmaxxing': This incel uses a hammer to make his face 'more attractive' | The Secret World of Incels,tabloid-style news,,,
Taylor Swift commands a huge fan base — and for some it borders on spiritual,culture,,,
The future is here: 3 ways gene editing could change the world,national news,,,
Ontario's first measles death in decades offers grim reminder that unvaccinated kids are at risk,national news,,,
These Indigenous women are decolonizing parenting to help raise empowered children,national news,,,
Man airlifted to hospital after fighting off grizzly bear near Elkford B.C.,local news,,,
The solar storm knocked out GPS equipment on farms — and it could happen again,national news,,,
Usyk beats Fury by split decision to become 1st undisputed heavyweight champ in 24 years,sports,,,
Charlotte Cardin's show-stopping ballad and 5 more songs you need to hear this week,culture,,,
'He averted a catastrophe': Parent praises bus driver after 18-wheeler fell from overpass above,local news,,,
Seize the Grey wins Preakness ending Mystik Dan's Triple Crown bid,sports,,,
3 teen girls expected to plead guilty in swarming death of Kenneth Lee in Toronto court hears,local news,,,
Mango lassi chia pots: A creamy make-ahead pudding that's packed with protein,culture,,,
Finding out I had 600 half-siblings sent me on a quest to end sperm donor anonymity,national news,,,
Squirrels caused 80 outages in Toronto last year: hydro officials,local news,,,
Summer McIntosh posts world-leading time in 200m butterfly at Canadian swim trials,sports,,,
Mayor condemns video showing properties destroyed by wildfire near Fort Nelson,local news,,,
The new King Charles portrait: Brilliant or bizarre?,gossip,,,
Calgary lawyer resigns from firm after sending 'disturbing' and 'misogynistic' email,national news,,,
8 books you heard about on CBC Radio recently,culture,,,
The time a hot air balloon towing a car went missing over Uxbridge ON,local news,,,
Armed with new Canadian mark shot putter Mitton chasing big throws on Diamond League circuit,sports,,,
Canadian sentenced to 30 years for attacking Nancy Pelosi's husband with hammer,national news,,,
The best card games to play with a big group,culture,,,
Semi-detached Toronto home reno sparks bitter Beaches feud,local news,,,
